[
  {
    "id": "pool_fractions_multiplication_division_001",
    "schema_version": "1.0.0",
    "topic": "fractions",
    "subconcept": "multiplication_division",
    "question_text": "¿Cuánto es 3/4 * 2/3?",
    "options": {
      "A": "1/2",
      "B": "9/8",
      "C": "3/2",
      "D": "8/9"
    },
    "correct_option": "A",
    "distractors": {
      "B": {
        "misconception": "cross_multiplied_for_product",
        "explanation": "Multiplicaste en cruz en vez de numerador con numerador y denominador con denominador."
      },
      "C": {
        "misconception": "multiplied_only_numerators",
        "explanation": "Multiplicaste solo los numeradores y dejaste el primer denominador."
      },
      "D": {
        "misconception": "forgot_to_invert_divisor",
        "explanation": "Invertiste una fracción como en una división en vez de multiplicar directo."
      }
    }
  },
  {
    "id": "pool_fractions_multiplication_division_002",
    "schema_version": "1.0.0",
    "topic": "fractions",
    "subconcept": "multiplication_division",
    "question_text": "¿Cuánto es (3/4) / (2/3)?",
    "options": {
      "A": "1/2",
      "B": "9/8",
      "C": "3/8",
      "D": "8/9"
    },
    "correct_option": "B",
    "distractors": {
      "A": {
        "misconception": "forgot_to_invert_divisor",
        "explanation": "Olvidaste dar vuelta a la fracción que divide antes de multiplicar."
      },
      "C": {
        "misconception": "multiplied_only_numerators",
        "explanation": "Trabajaste solo con los de arriba y no tocaste los denominadores."
      },
      "D": {
        "misconception": "cross_multiplied_for_product",
        "explanation": "Diste vuelta a la fracción equivocada antes de multiplicar."
      }
    }
  },
  {
    "id": "pool_fractions_multiplication_division_003",
    "schema_version": "1.0.0",
    "topic": "fractions",
    "subconcept": "multiplication_division",
    "question_text": "¿Cuánto es 5/6 * 1/5?",
    "options": {
      "A": "25/6",
      "B": "5/6",
      "C": "1/6",
      "D": "6/25"
    },
    "correct_option": "C",
    "distractors": {
      "A": {
        "misconception": "cross_multiplied_for_product",
        "explanation": "Multiplicaste el de arriba de una con el de abajo de la otra."
      },
      "B": {
        "misconception": "multiplied_only_numerators",
        "explanation": "Solo multiplicaste los de arriba y dejaste un denominador sin multiplicar."
      },
      "D": {
        "misconception": "forgot_to_invert_divisor",
        "explanation": "Trataste la multiplicación como división e invertiste una fracción."
      }
    }
  },
  {
    "id": "pool_fractions_multiplication_division_004",
    "schema_version": "1.0.0",
    "topic": "fractions",
    "subconcept": "multiplication_division",
    "question_text": "¿Cuánto es (5/6) / (1/5)?",
    "options": {
      "A": "1/6",
      "B": "5/6",
      "C": "6/25",
      "D": "25/6"
    },
    "correct_option": "D",
    "distractors": {
      "A": {
        "misconception": "forgot_to_invert_divisor",
        "explanation": "Multiplicaste directamente sin invertir la segunda fracción."
      },
      "B": {
        "misconception": "multiplied_only_numerators",
        "explanation": "Dividiste solo los numeradores y dejaste el primer denominador."
      },
      "C": {
        "misconception": "cross_multiplied_for_product",
        "explanation": "Invertiste la primera fracción en vez de la segunda."
      }
    }
  },
  {
    "id": "pool_fractions_multiplication_division_005",
    "schema_version": "1.0.0",
    "topic": "fractions",
    "subconcept": "multiplication_division",
    "question_text": "¿Cuánto es 1/3 * 1/5?",
    "options": {
      "A": "1/15",
      "B": "1/3",
      "C": "3/5",
      "D": "5/3"
    },
    "correct_option": "A",
    "distractors": {
      "B": {
        "misconception": "multiplied_only_numerators",
        "explanation": "Multiplicaste arriba pero olvidaste multiplicar abajo."
      },
      "C": {
        "misconception": "forgot_to_invert_divisor",
        "explanation": "Le diste vuelta a la primera fracción aunque era una multiplicación."
      },
      "D": {
        "misconception": "cross_multiplied_for_product",
        "explanation": "Cruzaste los números al multiplicar en lugar de ir en línea recta."
      }
    }
  },
  {
    "id": "pool_fractions_multiplication_division_006",
    "schema_version": "1.0.0",
    "topic": "fractions",
    "subconcept": "multiplication_division",
    "question_text": "¿Cuánto es (1/3) / (1/5)?",
    "options": {
      "A": "1/3",
      "B": "5/3",
      "C": "3/5",
      "D": "1/15"
    },
    "correct_option": "B",
    "distractors": {
      "A": {
        "misconception": "multiplied_only_numerators",
        "explanation": "Dividiste arriba pero dejaste el denominador de la primera sin cambiar."
      },
      "C": {
        "misconception": "cross_multiplied_for_product",
        "explanation": "Invertiste la primera fracción y no la que divide."
      },
      "D": {
        "misconception": "forgot_to_invert_divisor",
        "explanation": "Multiplicaste en línea recta en vez de invertir el divisor."
      }
    }
  },
  {
    "id": "pool_fractions_multiplication_division_007",
    "schema_version": "1.0.0",
    "topic": "fractions",
    "subconcept": "multiplication_division",
    "question_text": "¿Cuánto es 1/6 * 2/5?",
    "options": {
      "A": "1/3",
      "B": "12/5",
      "C": "1/15",
      "D": "5/12"
    },
    "correct_option": "C",
    "distractors": {
      "A": {
        "misconception": "multiplied_only_numerators",
        "explanation": "Multiplicaste solo los numeradores y dejaste el primer denominador."
      },
      "B": {
        "misconception": "forgot_to_invert_divisor",
        "explanation": "Invertiste una fracción como en una división en vez de multiplicar directo."
      },
      "D": {
        "misconception": "cross_multiplied_for_product",
        "explanation": "Multiplicaste en cruz en vez de numerador con numerador y denominador con denominador."
      }
    }
  },
  {
    "id": "pool_fractions_multiplication_division_008",
    "schema_version": "1.0.0",
    "topic": "fractions",
    "subconcept": "multiplication_division",
    "question_text": "¿Cuánto es (1/6) / (2/5)?",
    "options": {
      "A": "1/12",
      "B": "12/5",
      "C": "1/15",
      "D": "5/12"
    },
    "correct_option": "D",
    "distractors": {
      "A": {
        "misconception": "multiplied_only_numerators",
        "explanation": "Trabajaste solo con los de arriba y no tocaste los denominadores."
      },
      "B": {
        "misconception": "cross_multiplied_for_product",
        "explanation": "Diste vuelta a la fracción equivocada antes de multiplicar."
      },
      "C": {
        "misconception": "forgot_to_invert_divisor",
        "explanation": "Olvidaste dar vuelta a la fracción que divide antes de multiplicar."
      }
    }
  },
  {
    "id": "pool_fractions_multiplication_division_009",
    "schema_version": "1.0.0",
    "topic": "fractions",
    "subconcept": "multiplication_division",
    "question_text": "¿Cuánto es 2/3 * 1/3?",
    "options": {
      "A": "2/9",
      "B": "1/2",
      "C": "2",
      "D": "2/3"
    },
    "correct_option": "A",
    "distractors": {
      "B": {
        "misconception": "forgot_to_invert_divisor",
        "explanation": "Trataste la multiplicación como división e invertiste una fracción."
      },
      "C": {
        "misconception": "cross_multiplied_for_product",
        "explanation": "Multiplicaste el de arriba de una con el de abajo de la otra."
      },
      "D": {
        "misconception": "multiplied_only_numerators",
        "explanation": "Solo multiplicaste los de arriba y dejaste un denominador sin multiplicar."
      }
    }
  },
  {
    "id": "pool_fractions_multiplication_division_010",
    "schema_version": "1.0.0",
    "topic": "fractions",
    "subconcept": "multiplication_division",
    "question_text": "¿Cuánto es (2/3) / (1/3)?",
    "options": {
      "A": "1/2",
      "B": "2",
      "C": "2/9",
      "D": "2/3"
    },
    "correct_option": "B",
    "distractors": {
      "A": {
        "misconception": "cross_multiplied_for_product",
        "explanation": "Invertiste la primera fracción en vez de la segunda."
      },
      "C": {
        "misconception": "forgot_to_invert_divisor",
        "explanation": "Multiplicaste directamente sin invertir la segunda fracción."
      },
      "D": {
        "misconception": "multiplied_only_numerators",
        "explanation": "Dividiste solo los numeradores y dejaste el primer denominador."
      }
    }
  },
  {
    "id": "pool_fractions_multiplication_division_011",
    "schema_version": "1.0.0",
    "topic": "fractions",
    "subconcept": "multiplication_division",
    "question_text": "¿Cuánto es 5/6 * 1/6?",
    "options": {
      "A": "1/5",
      "B": "5",
      "C": "5/36",
      "D": "5/6"
    },
    "correct_option": "C",
    "distractors": {
      "A": {
        "misconception": "forgot_to_invert_divisor",
        "explanation": "Le diste vuelta a la primera fracción aunque era una multiplicación."
      },
      "B": {
        "misconception": "cross_multiplied_for_product",
        "explanation": "Cruzaste los números al multiplicar en lugar de ir en línea recta."
      },
      "D": {
        "misconception": "multiplied_only_numerators",
        "explanation": "Multiplicaste arriba pero olvidaste multiplicar abajo."
      }
    }
  },
  {
    "id": "pool_fractions_multiplication_division_012",
    "schema_version": "1.0.0",
    "topic": "fractions",
    "subconcept": "multiplication_division",
    "question_text": "¿Cuánto es (5/6) / (1/6)?",
    "options": {
      "A": "1/5",
      "B": "5/36",
      "C": "5/6",
      "D": "5"
    },
    "correct_option": "D",
    "distractors": {
      "A": {
        "misconception": "cross_multiplied_for_product",